{
  "schema_version": 1,
  "execution_mode": "SIMULATED",
  "observed_at_utc": "2026-08-31T00:00:00+00:00",
  "host": {
    "os_description": "Microsoft Windows 11 Home",
    "os_version": "10.0.26200",
    "architecture": "X64",
    "windows_edition": "Home"
  },
  "capabilities": {
    "hypervisor": "AVAILABLE",
    "hyperv_management": "UNAVAILABLE",
    "windows_sdk": "AVAILABLE",
    "wdk_driver_targets": "UNAVAILABLE",
    "disposable_kernel_lab": "UNAVAILABLE"
  },
  "real_kernel_campaign": "BLOCKED",
  "reasons": [
    "Hyper-V management module is unavailable",
    "WDK driver build targets are not verified",
    "No disposable kernel lab exists"
  ],
  "evidence": {
    "source": "Initial host inventory; golden fixture is documentation, not a portable host assertion"
  }
}

